professor,course,comment,date
Michael Khan,RSM100,Really good prof but really tough. He wrote the textbook so be sure to read like a lot. Must go to the lectures and pay attention to his examples and what he says- it will show up again. Despite such a boring course his lectures were really interesting. Only reason I didnt enjoy him as much is cuz he came halfway through the semester,2018-07-08 23:26:25
Michael Khan,RSM219,The professor is so kind!!!!!!!Not a tough grader.,2018-07-04 01:17:39
Michael Khan,RSM100,"LOVE HIM. SO funny and a great lecturer. So passionate and makes this course so much FUN! He's a great prof. Just study the textbook and do the ORIEN quizzes on wileyplus because those are where the exam questions come from. ALSO, GO TO CLASS. All the examples from in class are on the exam and he does not upload the examples on portal.",2018-01-04 19:55:51
Michael Khan,RSM100,played us too hard with the finals. why make the finals easy if youre gonna get it marked/curved like hell.,2017-12-16 12:07:36
Michael Khan,RSM100,played us too hard with the finals. why make the finals easy if youre gonna get it marked/curved like hell,2017-12-16 12:07:10
Michael Khan,RSM100,"Professor Khan was much better than Oesch. He was engaging, provided valuable examples, and made it clear as to what was being tested. His lectures are worth attending; around 40% of the final is based on in-class discussions. Other than that, the course is textbook-heavy.",2017-12-16 04:46:44
Michael Khan,RSM100,Khan will be the nicest prof you are ever gonna get in UofT. Remember to go to his lectures. They are fun and will be extremely helpful for the final exam.,2017-12-10 21:39:28
Michael Khan,RSM100,Such a great prof. Very interesting lectures and is hard to fall asleep. Don't know about his accounting lectures but I enjoyed him 10X more than John.,2017-12-10 20:54:00
Michael Khan,RSM100,niceeeeeee,2017-12-09 13:20:17
Michael Khan,RSM100,Professor Khan is a great lecturer and encourages class discussion. He is very kind to students especially if you go to his classes so he knows ur face. Ive learned a lot from the two first-year courses he teaches.,2017-12-09 12:35:17
Michael Khan,RSM100,"I just toke RSM100 and Khan is a great professor!! He is caring, friendly and professional. Students feel involved in his lectures. The concept is easy to understand and it is really a interesting course :) Such an Unforgettable memories!",2017-12-09 12:34:27
Michael Khan,RSM100,Micheal Khan is so nice!!! We love this professor!,2017-12-09 12:33:59
Michael Khan,RSM100,So Sweet Really grate professor Please come to his lecture every time,2017-12-09 12:32:59
Michael Khan,RSM100,Best professor,2017-12-09 12:32:32
Michael Khan,RSM100RS,So warm,2017-12-09 12:32:24
Michael Khan,RSM100,Professor Khan is the best!!!!!!!,2017-12-09 12:32:02
Michael Khan,RSM100,"Great professor, don't understand how anyone could not like him. His lectures are so fun and engaging, unlike John who put everyone to sleep. So fun. Textbook use is mandatory and attend lectures because final exam questions are purely based on class discussions. Overall great prof!",2017-12-06 19:06:00
Michael Khan,RSM427,Not Good,2017-09-04 15:17:17
Michael Khan,RSM100,"This Professor does not positively add to the course. His lectures are boring, he is full of himself and  he does not really teach anything of substance. He puts overly specific questions on the exam just to get people to attend lectures and never stops talking about his summer abroad program. Overall, he is not a ""level 5 leader"".",2017-07-27 09:25:48
Michael Khan,MGT422,He is honestly a very nice and funny guy. Visit office hours and participate regularly and he will get to know you quickly. He provides allot of feedback if you ask and will redirect you to very smart T.A's.,2017-03-27 09:33:00
Michael Khan,RSM100,"Great lectures, awesome prof. He engages students throughout the lectures; however, you need to attend lectures in order to do well in the course. Also, there is A LOT of textbook reading. If you put in the work, you can do well.",2017-02-15 02:44:50
Michael Khan,RSM100,"Michael Khan's lectures are pretty interesting and do contain material that you will be tested on, so go! He is pretty arrogant and loves to talk about himself, though. It can get annoying but at least he isn't boring or anything. Seems like a decent guy overall and does make the material seem pretty interesting.",2017-01-30 01:37:39
Michael Khan,RSM100,amazing prof,2017-01-23 01:01:13
Michael Khan,RSM100,"If you can get a perfect on the final exam, you deserve a cookie. Expect pointless memorization. Most useless class as the concepts are repeated in upper RSM courses.",2017-01-12 23:56:50
Michael Khan,RSM100,"Professor Khan made RSM100 as interesting as it possibly could. His teaching style is class discussion based and you have to listen keenly as whatever is discussed is testable (literally, he says it himself).  This class is based on memorization of the text, class discussion and required readings.",2016-12-22 23:32:46
Michael Khan,RSM100,"How Khan is rated below at the very least a 4 is beyond me. Amazing engaging prof, super enthusiastic about everything, and taught in a very relevant manner. Difficulty is nowhere near as bad as people say, if you're decent at retaining info you'll get an 80. Sure you have to come to class, but you should be doing that anyway at UofT..",2016-12-06 13:45:10
Michael Khan,RSM100,"Good professor. He likes to engage with students and encourages participation. I do not like how he would sometimes pick on students and advertised his summer abroad program too much. He did have interesting lectures, though, as he talked a lot about current events.",2016-04-18 21:11:26
Michael Khan,RSM100,"he was clear, had light humour, and humble. Definitely humble. I never participated or went to office hours so this perception of him is strictly from lectures. If you're taking his class you have to read your textbook and do not skip class. But aside from that (which is really the bare minimum) there is not much extra work. Not very challenging.",2016-04-08 19:14:23
Michael Khan,MGT422,"Talks about he has all the designations (CPA, CISA, CGEIT), talks about he's the only person that can teach MGT422 / RSM427 because he is the only one with those designations. Pointless slides, every slide has the word ""inefficiency"" in it. Lectures are not related to any case or MCQ. MCQs are messed up. Cases are long and boring. Worst course ever",2016-03-29 14:21:19
Michael Khan,RSM100,Final exam focuses on accounting a lot. GO TO ECOMAN FOR THE FINAL FOR RSM WITH MICHAEL KHAN IT WILL HELP ALOT!,2015-04-25 08:06:57
Michael Khan,RSM100,Easily my least favourite professor in first year. Thinks too highly of himself that you feel some sort of barrier between yourself as a student and him. If this course was not a requirement I would have dropped it ONLY because I never feel comfortable at his lectures. He shushes students even if only two people are talking. He seems sharp though,2015-04-16 01:56:53
Michael Khan,RSM427,"This prof is one of those people you have to get to know. He is a very genuine, honest, and friendly guy who likes to be friendly with his students. Very out-of-the-box most of the times, although lectures can be monotonous sometimes due to the dry course subject matter. All in all, great prof. We're very lucky to have him in Rotman.",2015-04-01 23:15:26
Michael Khan,RSM100,"Michael Khan spends a lot of time talking about himself and he spends a lot of time discussing what people review him about. He then talks about how he took his kids to a farm for their birthday. He'll tell you about his summer abroad program.  He is not a  ""level 5 leader"", as he does not seem to take review criticism very well.  Not a real prof.",2015-02-10 11:45:45
Michael Khan,RSM100,"He is annoying as hell. He enjoys himself more than 90% of his students. He talks really fast. His lectures are mostly pointless (but he puts 50% of lecture stuffs on the final exam..) So basically, he forces his students to attend his boring lectures. The WORSE thing is, he is very ""proud' of himself. ",2015-01-20 11:09:33
Michael Khan,RSM100,"He is a good lecturer, I found his lectures to be interesting. Watch out for the exam because he tests on lecture material and in class discussions. Overall, I loved this class and found him to be a great professor. If you read the textbook and attend class, you will have no problem getting a good grade in this class.",2014-06-18 19:41:56
Michael Khan,RSM100,"Professor Khan was an OK teacher- not the best, nor the worst. He just seems full of himself, and spends way too much time promoting his Summer Abroad Program. A bit tricky when it comes to his exam- you have to know all material (whether it be from the textbook or lecture slides) in and out. Also, attend class when there are guest lecturers!",2014-05-21 18:32:18
Michael Khan,RSM100,"Lectures are useless from a material standpoint, he needs to add irrelevant test questions based on the overly specific lecture material just to get people to attend. Way, way too into himself. Jst likes to hear himself talk, especially if it's picking apart a student's earnest question. Didn't attend any lectures second semester and still got an A",2013-11-20 12:57:21
Michael Khan,RSM100,He talks really fast and tests us more of his lecture than the textbook. Gosh...who will pay attention for almost full year course and remember everything from his talking? The materials for final were so much including the freaking chapters and his lectures and so on. Dislike.,2013-05-14 03:22:44
Michael Khan,RSM100,Some snake tings in hurr. Tests be super hard and manz be failing in hurr. Serious snake movements in class #DustySweaterVest,2013-04-22 17:42:33
Michael Khan,RSM100,Prof is very very boring and is pretty useless. Test is super hard. test is 50% textbook and 50% from lecture. You really need to think in the exam and recall what is taught in class and think outside the box. I think the course average is around 50% but oh well. rotman need to kick people out anyways,2013-04-18 00:00:48
Michael Khan,RSM100,He is pretty good but moves through subject matter very fast.,2012-10-22 15:00:34
Michael Khan,RSM100,He is an amiable man who enjoys his own classes ore than the students do. His efforts to make the class lively and entertaining often end in making the classes useless to the students as the material taught is negligible. His tests often consist more of what is in the textbook than what is taught in class.,2012-10-14 19:25:24
Michael Khan,RSML020,"For the most part, I enjoyed this class even though I had taken this already at CAPE. He is an approachable prof. However, I found that he wasn't very fair when it came to marking participation. Some people who made a moderate attempt in participation got 7/10 whereas others who participated more didn't even pass/barely passed.",2012-07-02 18:50:51
Michael Khan,RSM1222,"(1)Out of 20 professors, he was the WORST.(2)Had a 20% participation grade but taught very poorly and elicited little interest from us.(3)He screwed us over in the final exams. Gave us a 3hr long paper for 2hrs. The first 50% were extremely easy questions, and the last 2 were cases - one was actually 3 pages of reading. No1 finished all questions.",2011-04-28 13:19:31
Maria Papaconstantinou,HMB204,"In HMB204 you can truly tell the professor enjoys the content and teaching it. She is extremely clear on what will be on the test (she emphasized topics multiple times and those were the exact short answer questions). She is clear-cut, helpful, and always willing to do more for her students and hear them out. ",2023-03-01 17:51:34
Maria Papaconstantinou,HMB204,"Dr P is overall pretty kind and knowledgeable and her tests are very fair and easy if you study. She tells you exactly what you need to know for her tests. On some slides, she speaks a lot on so you do have to transcribe a bit. She can sometimes sound a bit condescending when people ask Qs in lecture though.",2023-02-16 23:31:09
Maria Papaconstantinou,HMB204,"The pacing of her lectures is very inconsistent. This is due to the fact that she rambles a lot which complicates content further. The in-class question period runs on for too long. Her attitude during lecture is extremely palpable as she has no respect for the students, picking on minuscule things. This is an unwelcoming intro to Human Biology. ",2023-01-26 22:34:12
Maria Papaconstantinou,HMB204,"Despite having taught this course for many years, I genuinely believed she was a first time professor due to how inexperienced her teaching seems. She overcomplicates her words, and stutters over explanations. In one word, she is disrespectful. She doesn't care about your time, and seems to be picking a fight with the crowd for insignificant things",2023-01-26 22:33:35
Maria Papaconstantinou,HMB265,"Terse professor when dealing with student questions and extremely harsh grader, even asking all TAs to be especially tough with the assignment grading. I know I myself and even some straight A friends have gotten our GPAs nuked by this course. Be careful!",2022-12-14 01:05:04
Maria Papaconstantinou,HMB265,"Dr. P is the best prof! She is knowledgeable, caring, and responds quickly to emails. I enjoyed her lectures and she gave just the right amount of information to understand the relevance of the topic and to solve problems related to the material. Her slides were clear and up to date, her test was fair, and she helped us keep up with the material.  ",2022-08-22 21:51:40
Maria Papaconstantinou,HMB265,actual info tested is not the info focused on in class -- ie the problems involving math. too large a portion of class time is spent detailing info about disorders u will not be tested on. prof often rushed problem-solving due to time management issues while lecturing. the epistasis lecture needs updating as it is hard to follow due to poor figures,2022-06-09 04:04:51
Maria Papaconstantinou,HMB204,"Dr. P is an amazing professor! I loved the topics that she exposed us to, her lectures were interesting and informative, and she answered my emails quickly. I'd love to have her as my prof in future courses!",2022-06-08 19:05:35
Maria Papaconstantinou,HMB204,Quite harsh with her emails and explanations are too vague ,2022-03-21 02:08:58
Maria Papaconstantinou,HMB441,"Dr. P is one of the best professors that I have had at UofT. I have taken a couple of classes with her, and both times she was always available for help. Her lectures and assignments are interesting and very clear, and she provides good feedback. I would definitely recommend taking a class with her.",2022-01-21 04:50:57
Maria Papaconstantinou,HMB265,I asked to a request to regrade and instead she made me cry through an email. I don't think she actually knows what we are being taught in class and is incapable of addressing questions with material we are actually supposed to know.,2021-10-16 02:17:59
Maria Papaconstantinou,HMB265H,"I first took the class in the fall and had to drop it because I wasn't doing well. When I retook it in the summer, I felt that the lectures were clearer and the professor more accessible. I enjoyed my experience in the summer much more than in the fall, and would recommend taking the course in the summer instead.",2021-09-08 22:41:13
Maria Papaconstantinou,HMB265,"Lectures cover content on quizzes and tests. Explanations are fairly clear and clarifications are given for confused students. Tutorials have quizzes that are based on lecture content and similar to term tests. Homework isn't necessary but is helpful to complete for practice, although understanding the lecture slide examples is crucial.",2021-07-07 18:48:34
Maria Papaconstantinou,HMB265,"Prof. Maria is one of the best professors I have had at UofT so far, even though I have only interacted online with her. Her lectures are clear, her quizzes and tests are fair, and she responds to emails very quickly. She genuinely cares that her students do well.",2021-06-03 15:36:58
Maria Papaconstantinou,HMB265,Very useless. stay away from courses she's the admit. I've heard she was very unforgiving about making any accommodations for students. She also penalizes you for asking for a regrade. THE WORST PROF AT UOFT so far. I wouldn't have taken courses with her if I didn't absolutely had too. I had many bad profs but she is just malicious & mean.,2021-03-21 20:47:10
Maria Papaconstantinou,HMB321,"I had Professor P for both this course and another course in fourth year, HMB441. She is one of the best lecturers I've had at UofT. When the pandemic started, she was one of my only Professors to actually help students out. The online semester this year with her was also smooth and she didn't burden us with extra work like other Profs.",2021-03-09 17:53:22
Maria Papaconstantinou,HMB265,"I did not see any compassion from this prof at all, she was not nice and did not cooperate with her students.",2020-12-24 18:40:31
Maria Papaconstantinou,HMB305,"I took HMB265 in second year, a course Dr. P administers, and was unhappy with the structure. So when I took HMB305 I was apprehensive. But she's one of the best Professors I've had at UofT. Incredibly interesting lectures and she's extremely friendly and approachable. When COVID struck, she went out of her way to help us finish the semester.",2020-08-11 15:43:23
Maria Papaconstantinou,HMB265,Very rude and unforgiving.,2020-06-25 00:49:46
Maria Papaconstantinou,HMB203,"This course was one of my favourites. Dr. P's lectures were excellent, they really opened my eyes to what global health is and the challenges surrounding it. I enjoyed the group work, and it was an overall awesome learning experience. I can't wait to take other global health courses.",2020-04-20 20:24:24
Maria Papaconstantinou,HMB203,She taught the bare minimum. All of her lectures were really repetitive and she didn't talk about any of the nuances of global health which is the entire point of the field. We also had a ridiculous group project where you all did your own part and just slapped it together. The course was test heavy which doesn't make sense for the course.,2020-04-04 22:11:32
Maria Papaconstantinou,HMB265H,"Does not teach HMB265 yet writes a very unreasonable exam for it. Tested content never mentioned in class (particularly statistical term definition - not in textbook either). Students had to memorize random facts (not related to genetics) to pass the course, VERY disappointing. Only upside is she's willing to send emails to TAs on your behalf",2019-12-18 04:22:39
Maria Papaconstantinou,HMB265H,"Dr. P is one of the most caring and enthusiastic professors at UofT. Her lectures were interesting, she focused on what was important, and made genetics for me one of my favourite courses. She was always available to answer my questions, and her explanations were clear. I would definitely take another course with her!",2019-09-29 17:21:23
Maria Papaconstantinou,HMB265,"Here I am writing my lectures again. Because somehow people don't believe me when I say it. She is not a very competent professor. And here is why. She gives an amazing introduction, amazing background knowledge, but the material which she will test you on, she just skims through it. Also, her voice is really boring and unenthusiastic.",2019-09-15 02:28:06
Maria Papaconstantinou,HMB265,"Amazing prof, brilliant and funny and really makes HMB265 an informative and useful class.",2019-06-25 03:32:01
Maria Papaconstantinou,HMB321HMB441,"She's one of the best professors I've had at U of T! Her lectures were always clear, captivating and she always held sessions before the midterm/exam to clearly outline what our studying should focus on. I enjoyed both courses with her!",2019-02-27 03:17:57
Maria Papaconstantinou,HMB265,"Maria is a really great prof! She's approachable and lectures very clearly! She does talk fast and gives lots of important details you won't find in the textbook so recordings are helpful. The course is a lot of work (written & online assignments, virtual labs & tutorials) but the tests are fair and the questions reflect the connect assignments.",2018-07-09 15:38:41
Maria Papaconstantinou,HMB265H,"She's one of the few profs that actually cares about her students. Her lectures were clear, her test questions fair, and she provided a lot of different ways to learn the material. Many thought the midterm was hard, but it actually was fair. You have to put the work in, and it's not a memorizing type of course, but the material is interesting.",2017-12-16 22:48:58
Maria Papaconstantinou,HMB265,I enjoyed the lectures by Prof. P and she's always available to answer questions. There is a lot of work in the course but the online homework helps me keep up with the class.,2017-11-30 09:24:39
Maria Papaconstantinou,HMB265,"Although the course has a pretty heavy workload, I enjoyed her lectures, her test was fair, and her instructions are clear. You can see that Dr. P puts alot of effort into the course, and she is always available to answer questions. I wish my other profs answered my questions and emails so quickly!!",2017-11-20 20:55:58
Maria Papaconstantinou,HMB265,"Prof. P is one of the best profs that I have had so far. She genuinely wants you to learn, her lecturing style is great, and there are online assignments that help you keep up with the course material.",2017-11-12 03:43:35
Maria Papaconstantinou,HMB265H,"Dr. P is an excellent prof who really cares about her students. Her lectures are clear and she emphasizes all of the important points. You have to attend class to do well in my opinion, but her test was fair. I think that most complaints come from students that don't attend class and/or don't study enough to keep up with the work.",2017-11-12 03:37:08
Maria Papaconstantinou,HMB265,I found her lecture style to be quite unhelpful and confusing. Her content is really tough too.,2017-11-11 01:00:31
Maria Papaconstantinou,HMB265,The concepts in this course are pretty simple and straight forwards but she keeps spending the first half of the lecture talking about unimportant details and background information. She then rushes though the important bits that she leaves at the end of lectures. The test questions are also completely different than the homework questions.,2017-10-31 16:40:01
Maria Papaconstantinou,HMB265H,"Dr. P is a great professor. For learnsmart assignments you ""have to read the textbook,"" but believe me you don't. She will mention all the important points in lecture, so only use the textbook to clarify concepts you're shaky on. She is very clear, but VERY tough. Do a lot of practice problems. Her tests are tricky, but fair.",2017-10-21 11:13:48
Maria Papaconstantinou,HMB204,i wasn't really a fan of her from HMB265 which she made really hard but HMB204 is really soft course. Dr. Maria is really kind and tells u imp stuff from lectures.,2017-07-14 01:27:49
Maria Papaconstantinou,HMB204,"Dr. Maria is one of the best profs that I have had so far, and this course was one of my favourite courses. I enjoyed the variety of topics and the prof was always accessible for help.",2017-04-07 16:24:32
Maria Papaconstantinou,HMB204,The way she teach is just OMGi try to stay awake or understand or read over the lecture or anything you could think of. BUT IT DOESN'T MAKE SENSE. she reads off the slide and just the way she speak and present make a easy course really hardHARD TO LISTEN and pull information out of it. She also correct herself all the time........,2017-03-16 15:22:55
Maria Papaconstantinou,HMB204,"Genuinely a very fun person to learn from, and her teaching style is great.",2017-01-12 14:52:31
Maria Papaconstantinou,HMB265,Her 2016 midterm and exam were HORRIBLE. She's super caring as a person (from my interactions) and she means well. But for some reason HMB265 this year was the most horrible thing I've ever experienced...,2017-01-10 01:28:40
Maria Papaconstantinou,HMB265,Solid prof,2016-10-15 17:12:06
Maria Papaconstantinou,HMB321H,This was one of my favourite courses at UofT.  Dr. Maria is one of the most helpful and approachable profs and the variety of topics was enjoyable and informative.,2016-03-25 01:01:24
Maria Papaconstantinou,HMB265H,"This course was one of the most challenging courses I have taken, but the Prof's enthusiasm, helpful nature and clear explanation of material made the learning enjoyable.  Thanks Prof!",2016-03-03 15:04:15
Maria Papaconstantinou,HMB265,Dr. P's lectures were organized and the content was clearly presented. The course included a number of different teaching approaches that helped reinforce the material.  Excellent course overall.,2016-02-26 00:01:47
Maria Papaconstantinou,HMB265,"One of the hardest courses I've ever taken in my undergrad. She was extremely unhelpful, and not at all clear in her lectures. ",2015-11-12 16:07:09
Maria Papaconstantinou,HMB265,Awesome professor! She was available for help and made the material more interesting!,2014-07-31 12:15:11
Maria Papaconstantinou,HMB265,"She is a great prof overall. Enthusiastic and knowledgeable. However, the 2nd part of the course is significantly harder than the 1st so don't be caught off guard. Attending tutorials is probably the most crucial part  of this course since tests are 'problem solving' based not memorization based. A challenging course, but manageable overall.",2014-07-07 04:12:26
Maria Papaconstantinou,HMB265H,"Dr. P is one of the most helpful profs at UofT! She is passionate about genetic and knowledgeable about  the subject.  Most importantly, she encourages the application of concepts rather than just regurgitation.",2014-06-20 00:25:27
Maria Papaconstantinou,HMB265,Good prof overall,2014-06-12 04:41:17
